Symbol,Name,Last Sale,Net Change,% Change,Market Cap,Country,IPO Year,Volume,Sector,Industry
MNR,Monmouth Real Estate Investment Corporation Class A Common Stock,$20.97,0.02,0.095%,2062177554.00,United States,,833778,Consumer Services,Real Estate Investment Trusts
MNSO,MINISO Group Holding Limited American Depositary Shares each representing four Class A Ordinary Shares,$10.07,0.16,1.615%,3085363291.00,China,2020,2091163,Consumer Services,Department/Specialty Retail Stores
MO,Altria Group Inc.,$46.70,-0.18,-0.384%,85787377987.00,United States,,7523881,Consumer Non-Durables,Farming/Seeds/Milling
MOH,Molina Healthcare Inc Common Stock,$316.73,0.35,0.111%,18497032000.00,United States,2003,130450,Health Care,Medical Specialities
MOS,Mosaic Company (The) Common Stock,$39.18,0.46,1.188%,14512680569.00,United States,,3863989,Basic Industries,Agricultural Chemicals
MP,MP Materials Corp. Common Stock,$43.12,-0.40,-0.919%,7670027996.00,,2020,1322727,Basic Industries,Metal Mining
MPC,Marathon Petroleum Corporation Common Stock,$63.04,-0.06,-0.095%,38806647410.00,United States,,4658263,Energy,Integrated oil Companies
MPLN,MultiPlan Corporation Class A Common Stock,$4.42,0.13,3.03%,2821181224.00,,2020,1414174,Health Care,Medical Specialities
MPLX,MPLX LP Common Units Representing Limited Partner Interests,$28.86,0.28,0.98%,29433264593.00,United States,2012,1301207,Energy,Oil & Gas Production
MPW,Medical Properties Trust Inc. common stock,$22.66,-0.12,-0.527%,13512158000.00,United States,2005,2349875,Consumer Services,Real Estate Investment Trusts
MRK,Merck & Company Inc. Common Stock (new),$75.73,-0.43,-0.565%,191289734273.00,United States,,9883801,Health Care,Biotechnology: Pharmaceutical Preparations
MRO,Marathon Oil Corporation Common Stock,$16.00,-0.04,-0.249%,12456590352.00,United States,,10039372,Energy,Oil & Gas Production
MS,Morgan Stanley Common Stock,$99.34,1.04,1.058%,178256883510.00,United States,,4482159,Finance,Investment Bankers/Brokers/Service
MSA,MSA Safety Incorporated Common Stock,$147.19,-0.41,-0.278%,5770938825.00,United States,,38841,Miscellaneous,Diversified Manufacture
MSCI,MSCI Inc Common Stock,$611.27,7.09,1.173%,50397202867.00,United States,,183738,Technology,Advertising
MSGE,Madison Square Garden Entertainment Corp. Class A Common Stock ,$71.10,2.25,3.268%,2431032074.00,,2020,260254,Consumer Services,Movies/Entertainment
MSGS,Madison Square Garden Sports Corp. Class A Common Stock (New),$174.08,5.51,3.269%,4215893985.00,United States,2015,124396,Consumer Services,Hotels/Resorts
MSI,Motorola Solutions Inc. Common Stock,$262.90,-1.69,-0.639%,44403149595.00,United States,,565822,Technology,Radio And Television Broadcasting And Communications Equipment
MSM,MSC Industrial Direct Company Inc. Common Stock,$83.94,0.33,0.395%,4682120402.00,United States,1995,335218,Capital Goods,Industrial Machinery/Components
MSP,Datto Holding Corp. Common Stock,$26.64,-0.25,-0.93%,4344277401.00,United States,2020,145772,Technology,Computer Software: Prepackaged Software
MT,Arcelor Mittal NY Registry Shares NEW,$32.08,-0.77,-2.344%,29689474782.00,Luxembourg,,2827814,Basic Industries,Steel/Iron Ore
MTB,M&T Bank Corporation Common Stock,$150.95,0.44,0.292%,19424935389.00,United States,,481067,Finance,Major Banks
MTD,Mettler-Toledo International Inc. Common Stock,$1626.23,21.29,1.327%,37379961731.00,Switzerland,1997,69318,Health Care,Medical Specialities
MTDR,Matador Resources Company Common Stock,$37.23,-0.10,-0.268%,4368404314.00,United States,2012,849846,Energy,Oil & Gas Production
MTG,MGIC Investment Corporation Common Stock,$14.09,0.23,1.659%,4587460032.00,United States,1991,4612862,Finance,Property-Casualty Insurers
MTH,Meritage Homes Corporation Common Stock,$116.98,-0.72,-0.612%,4364655403.00,United States,,247197,Capital Goods,Homebuilding
MTN,Vail Resorts Inc. Common Stock,$332.23,1.98,0.60%,13439105166.00,United States,1997,154009,Consumer Services,Movies/Entertainment
MTX,Minerals Technologies Inc. Common Stock,$71.75,-0.34,-0.472%,2388774616.00,United States,1992,111274,Basic Industries,Major Chemicals
MTZ,MasTec Inc. Common Stock,$91.29,0.54,0.595%,6783182399.00,United States,,222407,Basic Industries,Water Sewer Pipeline Comm & Power Line Construction
MUFG,Mitsubishi UFJ Financial Group Inc. Common Stock,$5.56,0.05,0.907%,73847892867.00,Japan,,1035106,Finance,Commercial Banks
MUR,Murphy Oil Corporation Common Stock,$25.76,-0.10,-0.387%,3978867137.00,United States,,1006355,Energy,Oil & Gas Production
MUSA,Murphy USA Inc. Common Stock,$191.63,-1.93,-0.997%,4952685015.00,United States,2013,95574,Public Utilities,Natural Gas Distribution
MWA,MUELLER WATER PRODUCTS Common Stock,$14.12,0.12,0.857%,2230946402.00,United States,2006,434619,Capital Goods,Office Equipment/Supplies/Services
NABL,N-able Inc. Common Stock,$11.72,0.32,2.807%,2097553926.00,,2021,944595,Technology,EDP Services
NAC,Nuveen California Quality Municipal Income Fund,$15.43,0.12,0.784%,2233261960.00,United States,1999,138291,Finance,Investment Managers
NAD,Nuveen Quality Municipal Income Fund Common Stock,$15.91,0.07,0.442%,3713468061.00,United States,1999,235160,Finance,Investment Managers
NAPA,The Duckhorn Portfolio Inc. Common Stock,$22.48,-0.08,-0.355%,2586251907.00,,2021,287392,Consumer Non-Durables,Beverages (Production/Distribution)
NCLH,Norwegian Cruise Line Holdings Ltd. Ordinary Shares,$22.72,0.10,0.442%,9471784309.00,United States,,17647748,Transportation,Hotels/Resorts
NCR,NCR Corporation Common Stock,$39.30,0.13,0.332%,5187600000.00,United States,,485357,Miscellaneous,Office Equipment/Supplies/Services
NEA,Nuveen AMT-Free Quality Municipal Income Fund Common Shares of Beneficial Interest Par Value $.01,$15.47,0.01,0.065%,4626108439.00,United States,2002,320635,Finance,Finance/Investors Services
NEE,NextEra Energy Inc. Common Stock,$90.70,-0.10,-0.11%,177965834426.00,United States,,5845084,Public Utilities,Electric Utilities: Central
NEM,Newmont Corporation,$59.53,1.03,1.761%,47471323647.00,United States,,6113498,Basic Industries,Precious Metals
NEP,NextEra Energy Partners LP Common Units representing limited partner interests,$82.88,-0.16,-0.193%,6951392831.00,United States,2014,334045,Public Utilities,Electric Utilities: Central
NET,Cloudflare Inc. Class A Common Stock,$137.27,0.46,0.336%,44166015629.00,United States,2019,2017514,Technology,EDP Services
NEU,NewMarket Corp Common Stock,$342.84,2.83,0.832%,3588616332.00,United States,,27696,Basic Industries,Major Chemicals
NEWR,New Relic Inc. Common Stock,$109.27,0.58,0.534%,7147536678.00,United States,2014,497359,Technology,Computer Software: Prepackaged Software
NFG,National Fuel Gas Company Common Stock,$63.11,0.05,0.079%,5755005570.00,United States,,252507,Energy,Oil & Gas Production
NGG,National Grid Transco PLC National Grid PLC (NEW) American Depositary Shares,$72.37,0.10,0.138%,52353837227.00,United Kingdom,,191155,Public Utilities,Natural Gas Distribution
NGVT,Ingevity Corporation Common Stock ,$71.94,0.72,1.011%,2826249156.00,,2016,107651,Basic Industries,Industrial Specialties
NHI,National Health Investors Inc. Common Stock,$56.00,-0.07,-0.125%,2567633544.00,United States,,173664,Consumer Services,Real Estate Investment Trusts
NI,NiSource Inc Common Stock,$26.87,-0.05,-0.186%,10551974725.00,United States,,2113195,Public Utilities,Power Generation
NIO,NIO Inc. American depositary shares each  representing one Class A ordinary share,$30.52,0.67,2.245%,48544299466.00,,2018,38267838,Capital Goods,Auto Manufacturing
NJR,NewJersey Resources Corporation Common Stock,$40.47,0.04,0.099%,3883293629.00,United States,,316448,Public Utilities,Oil/Gas Transmission
NKE,Nike Inc. Common Stock,$165.67,0.23,0.139%,262225411175.00,United States,,3876187,Consumer Non-Durables,Shoe Manufacturing
NLSN,Nielsen N.V. Ordinary Shares,$21.04,0.40,1.938%,7551833380.00,Netherlands,2011,2843133,Miscellaneous,Business Services
NLY,Annaly Capital Management Inc Common Stock,$8.19,0.05,0.614%,11876488435.00,United States,,13344319,Consumer Services,Real Estate Investment Trusts
NMR,Nomura Holdings Inc ADR American Depositary Shares,$4.43,0.00,0.00%,13591684391.00,Japan,,594953,Finance,Investment Bankers/Brokers/Service
NNI,Nelnet Inc. Common Stock,$97.60,0.08,0.082%,3732404658.00,United States,2003,30787,Finance,Finance: Consumer Services
NNN,National Retail Properties Common Stock,$46.36,0.30,0.651%,8141599113.00,United States,,619471,Consumer Services,Real Estate Investment Trusts
NOC,Northrop Grumman Corporation Common Stock,$381.17,1.36,0.358%,59972389382.00,United States,,610455,Miscellaneous,Diversified Manufacture
NOK,Nokia Corporation Sponsored American Depositary Shares,$6.19,0.05,0.814%,34877889260.00,Finland,1994,13617709,Technology,Radio And Television Broadcasting And Communications Equipment
NOMD,Nomad Foods Limited Ordinary Shares,$25.13,0.29,1.167%,4439195778.00,,2016,429998,Consumer Non-Durables,Specialty Foods
NOV,NOV Inc. Common Stock,$13.52,-0.02,-0.148%,5282153596.00,United States,,1829275,Energy,Metal Fabrications
NOVA,Sunnova Energy International Inc. Common Stock,$26.80,0.43,1.631%,3008740914.00,United States,2019,1965016,Public Utilities,Electric Utilities: Central
NOW,ServiceNow Inc. Common Stock,$648.57,4.64,0.721%,129065430000.00,United States,2012,664718,Technology,Computer Software: Prepackaged Software
NPO,EnPro Industries Inc,$110.32,1.17,1.072%,2273126831.00,United States,,61872,,
NRG,NRG Energy Inc. Common Stock,$42.20,0.13,0.309%,10332191072.00,United States,,1463653,Public Utilities,Electric Utilities: Central
NRZ,New Residential Investment Corp. Common Stock,$11.03,0.18,1.659%,5146376518.00,United States,,3556978,Consumer Services,Real Estate Investment Trusts
NSA,National Storage Affiliates Trust Common Shares of Beneficial Interest,$67.09,-0.19,-0.282%,5975610428.00,,2015,344727,Consumer Services,Real Estate Investment Trusts
NSC,Norfolk Southern Corporation Common Stock,$287.53,2.24,0.785%,69968846673.00,United States,,1354179,Transportation,Railroads
NSP,Insperity Inc. Common Stock,$115.02,1.29,1.134%,4428470825.00,United States,,73533,Technology,Professional Services
NTCO,Natura &Co Holding S.A. American Depositary Shares ,$9.09,-0.06,-0.656%,6252918591.00,,2020,1262950,Consumer Non-Durables,Package Goods/Cosmetics
NTR,Nutrien Ltd. Common Shares,$74.99,0.77,1.037%,42803239590.00,,2018,2191834,Capital Goods,Aerospace
NU,Nu Holdings Ltd. Class A Ordinary Shares,$9.83,0.71,7.785%,45303368232.00,,2021,5777129,,
NUE,Nucor Corporation Common Stock,$114.30,0.66,0.581%,32666811298.00,United States,,1190697,Basic Industries,Steel/Iron Ore
NUS,Nu Skin Enterprises Inc. Common Stock,$49.50,-0.58,-1.158%,2466253697.00,United States,1996,414394,Health Care,Other Pharmaceuticals
NUV,Nuveen Municipal Value Fund Inc. Common Stock,$10.37,0.04,0.387%,2150516818.00,United States,1987,650062,Finance,Trusts Except Educational Religious and Charitable
NVG,Nuveen AMT-Free Municipal Credit Income Fund ,$17.78,0.05,0.282%,3795205044.00,United States,2002,165108,Finance,Investment Managers
NVO,Novo Nordisk A/S Common Stock,$108.43,-1.47,-1.338%,247175371623.00,Denmark,,1205562,Health Care,Biotechnology: Pharmaceutical Preparations
NVR,NVR Inc. Common Stock,$5784.63,-28.75,-0.495%,20146402779.00,United States,,7350,Capital Goods,Homebuilding
NVRO,Nevro Corp. Common Stock,$86.05,-0.14,-0.162%,3003500214.00,United States,2014,357840,Health Care,Biotechnology: Electromedical & Electrotherapeutic Apparatus
NVS,Novartis AG Common Stock,$86.66,0.35,0.406%,193866351037.00,Switzerland,,3188150,Health Care,Biotechnology: Pharmaceutical Preparations
NVST,Envista Holdings Corporation Common Stock,$45.70,0.95,2.123%,7374533549.00,,2019,1488078,Health Care,Medical/Dental Instruments
NVT,nVent Electric plc Ordinary Shares ,$37.42,0.63,1.712%,6295446726.00,,2018,794610,Capital Goods,Electrical Products
NVTA,Invitae Corporation Common Stock,$16.61,-0.43,-2.523%,3760019702.00,United States,2015,2791477,Health Care,Medical Specialities
NWG,NatWest Group plc American Depositary Shares,$6.08,0.08,1.333%,34297072867.00,United Kingdom,,413647,Finance,Commercial Banks
NYCB,New York Community Bancorp Inc. Common Stock,$12.05,0.09,0.753%,5603500628.00,United States,,2226383,Finance,Banks
NYT,New York Times Company (The) Common Stock,$47.38,0.73,1.565%,7953949434.00,United States,,417997,Consumer Services,Newspapers/Magazines
NZF,Nuveen Municipal Credit Income Fund ,$17.075,-0.015,-0.088%,2426799828.00,United States,2007,102613,Finance,Finance Companies
O,Realty Income Corporation Common Stock,$69.22,0.08,0.116%,39161785096.00,United States,,2863586,Consumer Services,Real Estate Investment Trusts
OC,Owens Corning Inc Common Stock New,$88.83,1.53,1.753%,8926229297.00,United States,,1321644,,
OFC,Corporate Office Properties Trust Common Stock,$27.77,0.13,0.47%,3119261112.00,United States,,320767,Consumer Services,Real Estate Investment Trusts
OGE,OGE Energy Corp Common Stock,$37.21,0.01,0.027%,7448494633.00,United States,,1333798,Public Utilities,Electric Utilities: Central
OGN,Organon & Co. Common Stock ,$30.22,0.21,0.70%,7662281876.00,,2021,957678,Health Care,Biotechnology: Pharmaceutical Preparations
OGS,ONE Gas Inc. Common Stock,$75.71,0.79,1.054%,4057110231.00,,2014,139031,Public Utilities,Oil/Gas Transmission
OHI,Omega Healthcare Investors Inc. Common Stock,$28.22,-0.11,-0.388%,6743849723.00,United States,1992,2163843,Consumer Services,Real Estate Investment Trusts
OKE,ONEOK Inc. Common Stock,$58.02,0.24,0.415%,25873247508.00,United States,,1739392,Public Utilities,Oil & Gas Production
OLN,Olin Corporation Common Stock,$56.67,0.83,1.486%,9031920658.00,United States,,939456,Basic Industries,Industrial Specialties
OLO,Olo Inc. Class A Common Stock,$22.42,0.74,3.413%,3401240292.00,,2021,1669228,Technology,Computer Software: Prepackaged Software
OMC,Omnicom Group Inc. Common Stock,$72.19,0.62,0.866%,15344599703.00,United States,,1324198,Technology,Advertising
OMF,OneMain Holdings Inc. Common Stock,$50.17,-0.08,-0.159%,6496322604.00,,2013,703498,Finance,Finance: Consumer Services
OMI,Owens & Minor Inc. Common Stock,$43.65,-0.49,-1.11%,3293643924.00,United States,,301188,Health Care,Medical Specialities
ONON,On Holding AG Class A Ordinary Shares,$38.61,0.94,2.495%,11951411794.00,,2021,1089950,,
ONTO,Onto Innovation Inc. Common Stock,$99.11,2.40,2.482%,4883986585.00,United States,,219484,Technology,Semiconductors
OR,Osisko Gold Royalties Ltd Common Shares,$12.03,0.17,1.433%,2002493866.00,,2016,275855,,
ORA,Ormat Technologies Inc. Common Stock,$73.68,-1.61,-2.138%,4126190594.00,United States,2004,258412,Public Utilities,Electric Utilities: Central
ORAN,Orange,$10.55,-0.07,-0.659%,27767295369.00,France,,1423783,Public Utilities,Telecommunications Equipment
ORCC,Owl Rock Capital Corporation Common Stock,$14.41,0.11,0.769%,5665328303.00,,2019,1085146,Finance,Diversified Financial Services
ORCL,Oracle Corporation Common Stock,$89.72,-0.14,-0.156%,239592504840.00,United States,1986,9650724,Technology,Computer Software: Prepackaged Software
ORI,Old Republic International Corporation Common Stock,$24.08,0.14,0.585%,7392770315.00,United States,,688920,Finance,Specialty Insurers
OSH,Oak Street Health Inc. Common Stock,$35.10,0.49,1.416%,8456549774.00,United States,2020,899272,Health Care,Assisted Living Services
OSK,Oshkosh Corporation (Holding Company)Common Stock,$110.22,0.74,0.676%,7438418022.00,United States,,302341,Capital Goods,Auto Manufacturing
OTIS,Otis Worldwide Corporation Common Stock ,$85.25,0.94,1.115%,36211554266.00,,2020,933058,,
OUT,OUTFRONT Media Inc. Common Stock,$25.89,-0.10,-0.385%,3770044635.00,,2014,913171,Consumer Services,Real Estate Investment Trusts
OVV,Ovintiv Inc. (DE),$32.45,-0.02,-0.062%,8472189591.00,Canada,,2442207,Energy,Oil & Gas Production
OWL,Blue Owl Capital Inc. Class A Common Stock,$14.93,-0.07,-0.467%,5444928226.00,United States,2020,2617846,Finance,Investment Managers
OXY,Occidental Petroleum Corporation Common Stock,$28.85,-0.07,-0.242%,26945351302.00,United States,,8395834,Energy,Oil & Gas Production
PAC,Grupo Aeroportuario Del Pacifico S.A. B. de C.V. Grupo Aeroportuario Del Pacifico S.A. de C.V. (each representing 10 Series B shares),$132.40,-0.10,-0.075%,6814698437.00,Mexico,2006,28259,,
PACK,Ranpak Holdings Corp Class A Common Stock,$35.54,0.43,1.225%,2892773858.00,,2018,191489,Basic Industries,Containers/Packaging
PAG,Penske Automotive Group Inc. Common Stock,$102.85,0.91,0.893%,7996863241.00,United States,,178601,Consumer Services,Other Specialty Stores
PAGS,PagSeguro Digital Ltd. Class A Common Shares,$26.71,1.11,4.336%,8803420376.00,Cayman Islands,2018,2893510,Technology,EDP Services
PATH,UiPath Inc. Class A Common Stock,$44.40,0.24,0.543%,23320130437.00,,2021,2356336,Technology,Computer Software: Prepackaged Software
PAY,Paymentus Holdings Inc. Class A Common Stock,$31.55,0.87,2.836%,3786723789.00,,2021,432931,Technology,Retail: Computer Software & Peripheral Equipment
PAYC,Paycom Software Inc. Common Stock,$423.83,2.08,0.493%,25440742867.00,,2014,146759,Technology,Computer Software: Prepackaged Software
PB,Prosperity Bancshares Inc. Common Stock,$71.56,0.26,0.365%,6595324180.00,United States,,240956,Finance,Major Banks
PBA,Pembina Pipeline Corp. Ordinary Shares (Canada),$30.11,0.14,0.467%,16571444413.00,Canada,,888129,Energy,Oil & Gas Production
PBH,Prestige Consumer Healthcare Inc. Common Stock,$61.88,-0.74,-1.182%,3100445483.00,United States,2005,150596,Health Care,Biotechnology: Pharmaceutical Preparations
PBR,Petroleo Brasileiro S.A.- Petrobras Common Stock,$10.79,0.09,0.841%,70373465798.00,Brazil,,20399595,Energy,Oil & Gas Production
PCG,Pacific Gas & Electric Co. Common Stock,$12.00,-0.01,-0.083%,23824430412.00,United States,,5668888,Public Utilities,Power Generation
PCOR,Procore Technologies Inc. Common Stock,$81.72,0.84,1.039%,10854720095.00,,2021,314522,Technology,EDP Services
PD,PagerDuty Inc. Common Stock,$36.15,-0.54,-1.472%,3108177470.00,,2019,644958,Technology,Retail: Computer Software & Peripheral Equipment
PDM,Piedmont Office Realty Trust Inc. Class A Common Stock,$18.06,0.06,0.333%,2241911005.00,United States,,344530,Consumer Services,Building operators
PEAK,Healthpeak Properties Inc. Common Stock,$35.19,-0.23,-0.649%,18969951527.00,United States,,1648001,Consumer Services,Real Estate Investment Trusts
PEB,Pebblebrook Hotel Trust Common Shares of Beneficial Interest,$22.28,0.01,0.045%,2927202434.00,United States,2009,608701,Consumer Services,Real Estate Investment Trusts
PEG,Public Service Enterprise Group Incorporated Common Stock,$64.58,-0.02,-0.031%,32655759938.00,United States,,1190338,Public Utilities,Electric Utilities: Central
PEN,Penumbra Inc. Common Stock,$275.55,4.47,1.649%,10294207696.00,,2015,208525,Health Care,Medical/Dental Instruments
PFE,Pfizer Inc. Common Stock,$58.71,-0.84,-1.411%,329531397969.00,United States,,39160702,Health Care,Biotechnology: Pharmaceutical Preparations
PFGC,Performance Food Group Company Common Stock,$45.16,0.75,1.689%,6968850046.00,United States,2015,905374,Consumer Non-Durables,Food Distributors
PFSI,PennyMac Financial Services Inc. Common Stock,$69.96,0.54,0.778%,4129683532.00,United States,2013,288699,Finance,Finance: Consumer Services
PG,Procter & Gamble Company (The) Common Stock,$160.10,0.78,0.49%,387433645822.00,United States,,5640934,Consumer Non-Durables,Package Goods/Cosmetics
PGR,Progressive Corporation (The) Common Stock,$101.25,0.09,0.089%,59170500000.00,United States,,2133269,Finance,Property-Casualty Insurers
PH,Parker-Hannifin Corporation Common Stock,$311.89,5.41,1.765%,40082528691.00,United States,,633153,Capital Goods,Office Equipment/Supplies/Services
PHG,Koninklijke Philips N.V. NY Registry Shares,$36.30,0.72,2.024%,33044107800.00,Netherlands,,1191228,Health Care,Biotechnology: Electromedical & Electrotherapeutic Apparatus
PHI,PLDT Inc. Sponsored ADR,$37.02,0.12,0.325%,7996320000.00,Philippines,,21325,Public Utilities,Telecommunications Equipment
PHM,PulteGroup Inc. Common Stock,$54.65,0.11,0.202%,13836596702.00,United States,,1080100,,
PHR,Phreesia Inc. Common Stock,$44.23,1.70,3.997%,2266339008.00,United States,2019,531030,Health Care,Managed Health Care
PII,Polaris Inc. Common Stock,$106.27,1.02,0.969%,6448650741.00,United States,,389252,Consumer Non-Durables,Recreational Products/Toys
PINS,Pinterest Inc. Class A Common Stock,$37.42,0.16,0.429%,24405193105.00,,2019,6255613,,
PIPR,Piper Sandler Companies Common Stock,$180.09,2.22,1.248%,3219684138.00,United States,,42735,Finance,Investment Bankers/Brokers/Service
PK,Park Hotels & Resorts Inc. Common Stock ,$19.29,0.14,0.731%,4561683363.00,United States,2016,1563992,Consumer Services,Real Estate Investment Trusts
PKG,Packaging Corporation of America Common Stock,$131.30,0.31,0.237%,12472287576.00,United States,2000,453242,Basic Industries,Paper
PKI,PerkinElmer Inc. Common Stock,$193.77,2.26,1.18%,24453811204.00,United States,,622313,Health Care,Medical Specialities
PKX,POSCO Common Stock,$60.14,0.11,0.183%,18192487600.00,South Korea,1994,178870,Basic Industries,Steel/Iron Ore
PLAN,Anaplan Inc. Common Stock,$46.12,0.63,1.385%,6810154007.00,United States,2018,1443494,Technology,Computer Software: Prepackaged Software
PLD,Prologis Inc. Common Stock,$161.75,-0.51,-0.314%,119586142250.00,United States,,3047842,Consumer Services,Real Estate Investment Trusts
PLNT,Planet Fitness Inc. Common Stock,$90.97,1.66,1.859%,7581854987.00,United States,2015,602930,Consumer Services,Other Consumer Services
PLTR,Palantir Technologies Inc. Class A Common Stock,$18.93,0.05,0.265%,37951260205.00,,2020,24698092,Technology,Retail: Computer Software & Peripheral Equipment
PM,Philip Morris International Inc Common Stock,$92.93,0.02,0.022%,144675996302.00,United States,,2924377,Consumer Non-Durables,Farming/Seeds/Milling
PNC,PNC Financial Services Group Inc. (The) Common Stock,$197.93,0.81,0.411%,83653294930.00,United States,,707829,Finance,Major Banks
PNM,PNM Resources Inc. (Holding Co.) Common Stock,$45.07,0.10,0.222%,3868577771.00,United States,,1785620,Public Utilities,Electric Utilities: Central
PNR,Pentair plc. Ordinary Share,$71.22,1.20,1.714%,11785358757.00,Switzerland,,711861,Capital Goods,Fluid Controls
PNW,Pinnacle West Capital Corporation Common Stock,$68.91,0.36,0.525%,7774345093.00,United States,,1058810,Public Utilities,Electric Utilities: Central
POR,Portland General Electric Co Common Stock,$51.32,-0.77,-1.478%,4588501339.00,United States,,387263,Public Utilities,Electric Utilities: Central
POST,Post Holdings Inc. Common Stock,$107.06,0.66,0.62%,6698065333.00,United States,2012,200450,Consumer Non-Durables,Food Distributors
PPG,PPG Industries Inc. Common Stock,$167.06,1.32,0.796%,39660186502.00,United States,,709123,Basic Industries,Paints/Coatings
PPL,PPL Corporation Common Stock,$29.42,0.01,0.034%,22086061837.00,United States,,2280858,Public Utilities,Electric Utilities: Central
PRG,PROG Holdings Inc. Common Stock,$45.04,0.27,0.603%,2945223476.00,United States,,345293,Technology,Diversified Commercial Services
PRGO,Perrigo Company plc Ordinary Shares,$39.54,0.23,0.585%,5289419255.00,United States,,874963,Health Care,Biotechnology: Pharmaceutical Preparations
PRI,Primerica Inc. Common Stock,$153.57,2.60,1.722%,6064457186.00,United States,2010,102134,Finance,Life Insurance
PRM,Perimeter Solutions SA Ordinary Shares,$14.00,1.15,8.949%,2199926890.00,,2021,291574,,
PRMW,Primo Water Corporation Common Stock,$17.47,0.09,0.518%,2796924761.00,Canada,,331098,Consumer Non-Durables,Soft Drinks
PRU,Prudential Financial Inc. Common Stock,$108.25,1.34,1.253%,40918500000.00,United States,2001,1222403,Finance,Life Insurance
PSA,Public Storage Common Stock,$362.45,-2.98,-0.815%,63557260272.00,United States,,530219,Consumer Services,Real Estate Investment Trusts
PSB,PS Business Parks Inc. (MD) Common Stock,$180.65,-2.11,-1.155%,4977014987.00,United States,,66723,Consumer Services,Real Estate Investment Trusts
PSFE,Paysafe Limited Common Shares,$4.07,0.21,5.44%,2945509395.00,,2021,10229093,Miscellaneous,Business Services
PSN,Parsons Corporation Common Stock,$33.76,0.19,0.566%,3452222653.00,,2019,246612,Capital Goods,Industrial Machinery/Components
PSO,Pearson Plc Common Stock,$8.19,0.06,0.738%,6198064596.00,United Kingdom,,324394,Consumer Services,Books
PSTG,Pure Storage Inc. Class A Common Stock,$33.34,0.38,1.153%,9666836447.00,,2015,4941942,Technology,Electronic Components
PSTH,Pershing Square Tontine Holdings Ltd. Class A Common Stock,$19.74,0.01,0.051%,3948001974.00,,2020,725513,,
PSX,Phillips 66 Common Stock,$71.90,0.28,0.391%,31506726748.00,United States,,2970139,Energy,Integrated oil Companies
PSXP,Phillips 66 Partners LP Common Units representing limited partner interest in the Partnership,$35.98,0.13,0.363%,8215678453.00,United States,2013,749772,Energy,Oil & Gas Production
PTR,PetroChina Company Limited Common Stock,$44.56,0.56,1.273%,81554147708.00,China,,97677,Energy,Oil & Gas Production
PUK,Prudential Public Limited Company Common Stock,$33.95,0.18,0.533%,46620325129.00,United Kingdom,,265617,Finance,Life Insurance
PVG,Pretium Resources Inc. Ordinary Shares (Canada),$13.96,0.09,0.649%,2623056904.00,Canada,,697680,Basic Industries,Precious Metals
PVH,PVH Corp. Common Stock,$100.33,1.75,1.775%,7159521711.00,United States,,663814,,
PWR,Quanta Services Inc. Common Stock,$111.88,0.36,0.323%,15942819446.00,United States,,493092,Capital Goods,Engineering & Construction
PWSC,PowerSchool Holdings Inc. Class A Common Stock,$17.24,-0.11,-0.634%,3420447584.00,,2021,453435,Technology,Computer Software: Prepackaged Software
PXD,Pioneer Natural Resources Company Common Stock,$180.03,-0.97,-0.536%,43951390191.00,United States,,913371,Energy,Oil & Gas Production
