Symbol,Name,Last Sale,Net Change,% Change,Market Cap,Country,IPO Year,Volume,Sector,Industry
A,Agilent Technologies Inc. Common Stock,$157.80,1.02,0.651%,47655725767.00,United States,1999,1411035,Capital Goods,Electrical Products
AA,Alcoa Corporation Common Stock ,$59.36,0.05,0.084%,11106442806.00,,2016,7514203,Basic Industries,Metal Fabrications
AAP,Advance Auto Parts Inc.,$232.13,-0.66,-0.284%,14474507237.00,United States,,492798,Consumer Services,Other Specialty Stores
AAT,American Assets Trust Inc. Common Stock,$36.36,0.02,0.055%,2198764283.00,United States,2011,386536,Consumer Services,Real Estate Investment Trusts
AB,AllianceBernstein Holding L.P.  Units,$48.97,1.20,2.512%,4835990628.00,United States,,299995,Finance,Investment Managers
ABB,ABB Ltd Common Stock,$37.77,0.76,2.053%,75275610000.00,Switzerland,,837428,Consumer Durables,Electrical Products
ABBV,AbbVie Inc. Common Stock,$133.09,1.04,0.788%,235287211087.00,United States,2012,5701646,Health Care,Other Pharmaceuticals
ABC,AmerisourceBergen Corporation Common Stock,$129.53,1.72,1.346%,26959514250.00,United States,,717817,Health Care,Other Pharmaceuticals
ABEV,Ambev S.A. American Depositary Shares (Each representing 1 Common Share),$2.74,0.01,0.366%,43116764626.00,,2013,16973282,Consumer Non-Durables,Beverages (Production/Distribution)
ABG,Asbury Automotive Group Inc Common Stock,$164.42,0.81,0.495%,3803972452.00,United States,2002,131748,Consumer Services,Other Specialty Stores
ABM,ABM Industries Incorporated Common Stock,$41.53,0.64,1.565%,2792524378.00,United States,,417028,Technology,Diversified Commercial Services
ABR,Arbor Realty Trust Common Stock,$18.12,0.16,0.891%,2727163067.00,United States,2004,1089655,Consumer Services,Real Estate Investment Trusts
ABT,Abbott Laboratories Common Stock,$139.16,0.17,0.122%,246074814606.00,United States,,3491788,Health Care,Medical/Dental Instruments
ACA,Arcosa Inc. Common Stock ,$51.89,0.16,0.309%,2507827043.00,,2018,94546,Capital Goods,Engineering & Construction
ACC,American Campus Communities Inc Common Stock,$55.72,-0.22,-0.393%,7753809708.00,United States,2004,393639,Consumer Services,Real Estate Investment Trusts
ACH,Aluminum Corporation of China Limited American Depositary Shares,$14.58,0.73,5.271%,9927622864.00,China,2001,326191,Basic Industries,Aluminum
ACI,Albertsons Companies Inc. Class A Common Stock,$29.90,0.10,0.336%,13967034510.00,United States,2020,1229258,Consumer Services,Food Chains
ACM,AECOM Common Stock,$75.86,0.82,1.093%,10787462230.00,United States,2007,596683,Consumer Services,Military/Government/Technical
ACN,Accenture plc Class A Ordinary Shares (Ireland),$403.31,-0.38,-0.094%,254892216836.00,Ireland,2001,1374016,Technology,EDP Services
ADC,Agree Realty Corporation Common Stock,$68.66,0.27,0.395%,4894449453.00,United States,,407339,Consumer Services,Real Estate Investment Trusts
ADM,Archer-Daniels-Midland Company Common Stock,$65.44,0.82,1.269%,36609836054.00,United States,,2920735,,
ADNT,Adient plc Ordinary Shares ,$46.87,1.32,2.898%,4423497047.00,,2016,416738,Capital Goods,Auto Parts:O.E.M.
ADS,Alliance Data Systems Corporation Common Stock,$69.07,0.86,1.261%,3438657479.00,United States,2001,668299,Finance,Diversified Financial Services
ADT,ADT Inc. Common Stock,$8.56,0.21,2.515%,7115676987.00,United States,2018,1793515,Consumer Services,Diversified Commercial Services
ADX,Adams Diversified Equity Fund Inc.,$19.27,0.21,1.102%,2139492622.00,United States,,273577,Finance,Investment Managers
AEE,Ameren Corporation Common Stock,$87.02,-0.04,-0.046%,22416890741.00,United States,,922186,Public Utilities,Power Generation
AEG,AEGON N.V. Common Stock,$4.93,0.21,4.449%,9906319361.00,Netherlands,,1800291,Finance,Life Insurance
AEL,American Equity Investment Life Holding Company Common Stock,$38.56,0.26,0.679%,3567321216.00,United States,2003,159469,Finance,Life Insurance
AEM,Agnico Eagle Mines Limited Common Stock,$51.60,-0.73,-1.395%,12635102473.00,Canada,,2114476,,
AEO,American Eagle Outfitters Inc. Common Stock,$23.25,0.21,0.911%,3920453618.00,United States,,2557944,Consumer Services,Clothing/Shoe/Accessory Stores
AER,AerCap Holdings N.V. Ordinary Shares,$63.96,-0.05,-0.078%,15662453676.00,Netherlands,2006,690778,Technology,Diversified Commercial Services
AES,The AES Corporation Common Stock,$23.55,-0.02,-0.085%,15701110673.00,United States,,3790735,Public Utilities,Electric Utilities: Central
AFG,American Financial Group Inc. Common Stock,$135.40,0.65,0.482%,11482987223.00,United States,,149887,Finance,Property-Casualty Insurers
AFL,AFLAC Incorporated Common Stock,$57.69,0.51,0.892%,38163562954.00,United States,,2326614,Finance,Accident &Health Insurance
AG,First Majestic Silver Corp. Ordinary Shares (Canada),$11.54,0.15,1.317%,2961307258.00,Canada,,4313858,,
AGCO,AGCO Corporation Common Stock,$115.60,1.24,1.084%,8650830399.00,United States,,264328,Capital Goods,Industrial Machinery/Components
AGI,Alamos Gold Inc. Class A Common Shares,$7.53,0.09,1.21%,2951479161.00,Canada,2015,1486074,,
AGL,agilon health inc. Common Stock,$27.39,0.33,1.22%,10782222036.00,,2021,2304142,Health Care,Managed Health Care
AGO,Assured Guaranty Ltd. Common Stock,$48.88,0.61,1.264%,3414306566.00,Bermuda,2004,281721,Finance,Property-Casualty Insurers
AGR,Avangrid Inc. Common Stock,$48.82,0.46,0.951%,18903326424.00,United States,2015,522194,Public Utilities,Electric Utilities: Central
AGTI,Agiliti Inc. Common Stock,$22.48,0.50,2.275%,2937073708.00,,2021,205285,Health Care,Managed Health Care
AI,C3.ai Inc. Class A Common Stock,$34.25,0.81,2.422%,3597528621.00,,2020,2709825,Technology,Computer Software: Prepackaged Software
AIG,American International Group Inc. New Common Stock,$56.57,1.30,2.352%,48736510772.00,United States,,3980669,Finance,Life Insurance
AIN,Albany International Corporation Common Stock,$88.53,0.10,0.113%,2866689930.00,United States,,135151,Basic Industries,Textiles
AIRC,Apartment Income REIT Corp. Common Stock,$53.24,-0.51,-0.949%,8357903867.00,,2020,462001,Consumer Services,Real Estate Investment Trusts
AIT,Applied Industrial Technologies Inc. Common Stock,$101.57,1.08,1.075%,3906120657.00,United States,,57673,Capital Goods,Industrial Machinery/Components
AIZ,Assurant Inc. Common Stock,$152.28,0.58,0.382%,8676413247.00,United States,2004,187056,Finance,Specialty Insurers
AJG,Arthur J. Gallagher & Co. Common Stock,$166.45,1.23,0.744%,34501423100.00,United States,,510949,Finance,Specialty Insurers
AJRD,Aerojet Rocketdyne Holdings Inc. Common Stock,$45.88,0.06,0.131%,3693368629.00,United States,,187542,Capital Goods,Military/Government/Technical
AL,Air Lease Corporation Class A Common Stock,$43.89,0.10,0.228%,5002896189.00,United States,2011,301183,Technology,Diversified Commercial Services
ALB,Albemarle Corporation Common Stock,$227.90,2.67,1.185%,26658902872.00,United States,,810046,Basic Industries,Industrial Specialties
ALC,Alcon Inc. Ordinary Shares,$86.62,0.39,0.452%,42452462000.00,Switzerland,2019,433283,Health Care,Ophthalmic Goods
ALE,Allete Inc.,$64.62,0.14,0.217%,3397232753.00,United States,,122618,Public Utilities,Power Generation
ALIT,Alight Inc. Class A Common Stock,$10.75,0.27,2.576%,4803129466.00,,2021,1010819,Technology,EDP Services
ALK,Alaska Air Group Inc. Common Stock,$53.02,0.83,1.59%,6643971617.00,United States,,1995947,Transportation,Air Freight/Delivery Services
ALL,Allstate Corporation (The) Common Stock,$114.13,0.71,0.626%,32718336559.00,United States,,1063062,Finance,Property-Casualty Insurers
ALLE,Allegion plc Ordinary Shares,$127.28,1.03,0.816%,11416489315.00,United States,2013,364071,Consumer Services,Diversified Commercial Services
ALLY,Ally Financial Inc. Common Stock,$47.58,0.34,0.72%,16483805520.00,United States,2014,2047121,Finance,Diversified Financial Services
ALSN,Allison Transmission Holdings Inc. Common Stock,$34.60,0.40,1.17%,3607405411.00,United States,2012,769435,Capital Goods,Auto Parts:O.E.M.
ALV,Autoliv Inc. Common Stock,$101.06,2.84,2.891%,8840550934.00,Sweden,,412280,Capital Goods,Auto Parts:O.E.M.
AM,Antero Midstream Corporation Common Stock,$9.60,0.06,0.629%,4584036355.00,United States,2017,1571708,Public Utilities,Natural Gas Distribution
AMBP,Ardagh Metal Packaging S.A. Ordinary Shares,$8.89,-0.04,-0.448%,5713347404.00,,,1104804,,
AMC,AMC Entertainment Holdings Inc. Class A Common Stock,$28.52,-0.16,-0.558%,14658161560.00,,2013,36926189,Consumer Services,Movies/Entertainment
AMCR,Amcor plc Ordinary Shares,$11.66,0.05,0.431%,17876749351.00,,2019,7257244,Consumer Durables,Miscellaneous manufacturing industries
AME,AMETEK Inc.,$142.57,1.52,1.078%,32980028917.00,United States,,584613,Consumer Durables,Metal Fabrications
AMG,Affiliated Managers Group Inc. Common Stock,$160.79,1.11,0.695%,6536324778.00,United States,,243428,Finance,Investment Managers
AMH,American Homes 4 Rent Common Shares of Beneficial Interest,$42.47,-0.07,-0.165%,14201782534.00,,2013,936781,Consumer Services,Real Estate Investment Trusts
AMN,AMN Healthcare Services Inc AMN Healthcare Services Inc,$122.33,1.00,0.824%,5783151851.00,United States,,338731,Health Care,Assisted Living Services
AMOV,America Movil S.A.B. de C.V. Class A American Depositary Shares,$20.68,0.12,0.584%,66984794800.00,Mexico,,1152,Public Utilities,Telecommunications Equipment
AMP,Ameriprise Financial Inc. Common Stock,$302.28,3.59,1.202%,33822053883.00,United States,,345927,Finance,Investment Managers
AMRC,Ameresco Inc. Class A Common Stock,$77.91,-0.45,-0.574%,4016997529.00,United States,2010,152258,Basic Industries,Water Sewer Pipeline Comm & Power Line Construction
AMT,American Tower Corporation (REIT) Common Stock,$278.74,-2.51,-0.892%,126942013902.00,United States,,1016007,Finance,Trusts Except Educational Religious and Charitable
AMX,America Movil S.A.B. de C.V. American Depository Receipt Series L,$20.75,0.04,0.193%,67211532500.00,Mexico,,1565662,Public Utilities,Telecommunications Equipment
AN,AutoNation Inc. Common Stock,$112.12,0.38,0.34%,7348136705.00,United States,,507850,Consumer Services,Other Specialty Stores
ANET,Arista Networks Inc. Common Stock,$141.85,2.32,1.663%,43588175823.00,,2014,2319745,Technology,Computer peripheral equipment
ANTM,Anthem Inc. Common Stock,$455.71,1.80,0.397%,110607505000.00,United States,,646665,Health Care,Medical Specialities
AON,Aon plc Class A Ordinary Shares (Ireland),$292.41,-1.61,-0.548%,64427398838.00,United States,,1377950,Finance,Specialty Insurers
AOS,A.O. Smith Corporation Common Stock,$82.77,1.17,1.434%,13173847183.00,United States,,508277,Capital Goods,Industrial Machinery/Components
APAM,Artisan Partners Asset Management Inc. Class A Common Stock,$46.95,1.52,3.346%,3710911051.00,United States,2013,414193,Finance,Investment Managers
APD,Air Products and Chemicals Inc. Common Stock,$299.48,2.32,0.781%,66390029737.00,United States,,344735,Basic Industries,Specialty Chemicals
APG,APi Group Corporation Common Stock,$24.98,0.34,1.38%,5611137321.00,,2020,525770,Consumer Services,Military/Government/Technical
APH,Amphenol Corporation Common Stock,$85.06,1.07,1.274%,50868243137.00,United States,,1365320,Capital Goods,Electrical Products
APLE,Apple Hospitality REIT Inc. Common Shares,$16.21,0.03,0.185%,3701621809.00,United States,2015,1108913,Consumer Services,Real Estate Investment Trusts
APO,Apollo Global Management Inc. Class A Common Stock,$74.27,2.00,2.767%,18313458128.00,United States,2011,1761128,Finance,Investment Managers
APTV,Aptiv PLC Ordinary Shares,$162.40,1.58,0.982%,43931496336.00,United Kingdom,2011,698649,Capital Goods,Auto Parts:O.E.M.
AQN,Algonquin Power & Utilities Corp. Common Shares,$14.32,0.07,0.491%,9621526233.00,,2016,834847,Public Utilities,Electric Utilities: Central
AQUA,Evoqua Water Technologies Corp. Common Stock,$45.83,0.05,0.109%,5526514722.00,United States,2017,331892,Capital Goods,Office Equipment/Supplies/Services
AR,Antero Resources Corporation Common Stock,$18.06,-0.05,-0.276%,5669575656.00,,2013,3149468,Energy,Oil & Gas Production
ARE,Alexandria Real Estate Equities Inc. Common Stock,$217.63,-1.54,-0.703%,33724890838.00,United States,,448825,Consumer Services,Real Estate Investment Trusts
ARES,Ares Management Corporation Class A Common Stock,$81.36,2.36,2.987%,13920977668.00,,2014,468053,Finance,Investment Managers
ARMK,Aramark Common Stock,$36.05,0.61,1.721%,9230301086.00,,2013,1561058,Consumer Services,Restaurants
ARNC,Arconic Corporation Common Stock ,$33.84,0.26,0.774%,3603533819.00,,2020,1520220,Technology,Industrial Machinery/Components
ARW,Arrow Electronics Inc. Common Stock,$130.88,3.14,2.458%,9113068649.00,United States,,404421,Technology,Electronic Components
ASAI,Sendas Distribuidora S A ADS,$12.45,-0.03,-0.24%,3353265470.00,,2021,117036,Consumer Services,Food Chains
ASAN,Asana Inc. Class A Common Stock,$77.90,-1.43,-1.803%,14522851662.00,,2020,3205747,Technology,Retail: Computer Software & Peripheral Equipment
ASB,Associated Banc-Corp Common Stock,$22.46,0.25,1.126%,3370669317.00,United States,,729462,Finance,Major Banks
ASGN,ASGN Incorporated Common Stock,$120.90,1.13,0.943%,6298890000.00,United States,1992,184169,Technology,EDP Services
ASH,Ashland Global Holdings Inc. Common Stock,$104.31,0.40,0.385%,5936113431.00,United States,,182548,Basic Industries,Specialty Chemicals
ASR,Grupo Aeroportuario del Sureste S.A. de C.V. Common Stock,$199.34,1.55,0.784%,5980200000.00,Mexico,,15928,Transportation,Aerospace
ASX,ASE Technology Holding Co. Ltd. American Depositary Shares (each representing Two Common Shares) ,$7.57,-0.01,-0.132%,16180330248.00,,2018,2308744,Technology,Semiconductors
ATC,Atotech Limited Common Shares,$25.31,0.19,0.756%,4927751508.00,,2021,559666,Basic Industries,Major Chemicals
ATCO,Atlas Corp. Common Shares,$13.90,0.10,0.725%,3433405362.00,United Kingdom,,414010,Transportation,Marine Transportation
ATH,Athene Holding Ltd. Class A Common Shares,$85.21,2.42,2.923%,16372380368.00,Bermuda,2016,725743,Finance,Life Insurance
ATHM,Autohome Inc. American Depositary Shares each representing four class A ordinary shares.,$28.23,0.27,0.966%,3528172273.00,,2013,503085,,
ATKR,Atkore Inc. Common Stock,$106.28,1.08,1.027%,4926244116.00,United States,2016,207618,Technology,Electrical Products
ATO,Atmos Energy Corporation Common Stock,$102.73,0.61,0.597%,13632808997.00,United States,,1112829,Public Utilities,Oil/Gas Transmission
ATR,AptarGroup Inc. Common Stock,$116.33,0.94,0.815%,7657667241.00,United States,,223847,Capital Goods,Office Equipment/Supplies/Services
ATUS,Altice USA Inc. Class A Common Stock,$16.14,0.35,2.217%,7338109282.00,United States,2017,3210806,Public Utilities,Telecommunications Equipment
AU,AngloGold Ashanti Limited Common Stock,$20.11,-0.13,-0.642%,8392814787.00,South Africa,,1548008,Basic Industries,Precious Metals
AUY,Yamana Gold Inc. Ordinary Shares (Canada),$4.13,0.04,0.978%,3977838410.00,Canada,,11551858,,
AVA,Avista Corporation Common Stock,$41.30,0.07,0.17%,2922728436.00,United States,,230779,Public Utilities,Power Generation
AVAL,Grupo Aval Acciones y Valores S.A. ADR (Each representing 20 preferred shares),$5.24,0.06,1.158%,5837626491.00,,2014,55437,Finance,Commercial Banks
AVB,AvalonBay Communities Inc. Common Stock,$245.77,-1.41,-0.57%,34344126400.00,United States,,404496,Consumer Services,Real Estate Investment Trusts
AVLR,Avalara Inc. Common Stock,$133.73,-3.32,-2.422%,11623261301.00,United States,2018,1093918,Technology,EDP Services
AVNT,Avient Corporation Common Stock,$54.76,0.35,0.643%,5010067969.00,United States,,188290,Basic Industries,Major Chemicals
AVTR,Avantor Inc. Common Stock,$41.25,0.15,0.365%,25139924948.00,,2019,2357518,Basic Industries,Industrial Specialties
AVY,Avery Dennison Corporation Common Stock,$208.47,1.32,0.637%,17260395188.00,United States,,246325,Miscellaneous,Office Equipment/Supplies/Services
AWI,Armstrong World Industries Inc Common Stock,$114.12,0.39,0.343%,5417928824.00,United States,,142218,,
AWK,American Water Works Company Inc. Common Stock,$182.08,-1.29,-0.703%,33054393156.00,United States,2008,322820,Public Utilities,Water Supply
AWR,American States Water Company Common Stock,$100.35,-0.97,-0.957%,3706552888.00,United States,,62763,Public Utilities,Water Supply
AX,Axos Financial Inc. Common Stock,$55.05,0.93,1.718%,3275213072.00,United States,2018,131163,Finance,Savings Institutions
AXP,American Express Company Common Stock,$164.19,1.72,1.059%,127174310399.00,United States,,3140073,Finance,Finance: Consumer Services
AXS,Axis Capital Holdings Limited Common Stock,$52.08,0.95,1.858%,4414997474.00,Bermuda,2003,211711,Finance,Property-Casualty Insurers
AXTA,Axalta Coating Systems Ltd. Common Shares,$31.82,0.29,0.92%,7266127674.00,United States,2014,646123,Basic Industries,Paints/Coatings
AYI,Acuity Brands Inc. ,$208.99,2.84,1.378%,7311939191.00,United States,,156836,Consumer Durables,Building Products
AYX,Alteryx Inc. Class A Common Stock,$63.36,-0.48,-0.752%,4273876189.00,United States,2017,697988,Technology,Computer Software: Prepackaged Software
AZEK,The AZEK Company Inc. Class A Common Stock,$44.58,0.61,1.387%,6904390492.00,United States,2020,598407,,
AZO,AutoZone Inc. Common Stock,$2014.50,-9.66,-0.477%,41567990742.00,United States,,103098,,
B,Barnes Group Inc. Common Stock,$46.27,0.39,0.85%,2342525911.00,United States,,103225,Capital Goods,Office Equipment/Supplies/Services
BA,Boeing Company (The) Common Stock,$204.22,2.53,1.254%,120019935525.00,United States,,7405032,Capital Goods,Aerospace
BABA,Alibaba Group Holding Limited American Depositary Shares each representing eight Ordinary share,$118.66,0.85,0.722%,321677013709.00,China,2014,17548874,Consumer Services,Catalog/Specialty Distribution
BAC,Bank of America Corporation Common Stock,$44.42,0.14,0.316%,383222558360.00,United States,,34039002,Finance,Major Banks
BAH,Booz Allen Hamilton Holding Corporation Common Stock,$83.00,0.61,0.74%,11113422448.00,United States,2010,270968,Consumer Services,Professional Services
BAK,Braskem SA ADR,$20.14,0.15,0.75%,8016387359.00,Brazil,,157265,Basic Industries,Major Chemicals
BALY,Bally's Corporation Common Stock,$37.51,0.24,0.644%,2039170046.00,,2019,402662,Consumer Services,Recreational Products/Toys
BAM,Brookfield Asset Management Inc. Common Stock,$59.94,1.15,1.956%,94002757805.00,Canada,,1004008,Miscellaneous,Other Consumer Services
BAP,Credicorp Ltd. Common Stock,$119.89,1.17,0.986%,9533173240.00,Peru,,143528,Finance,Major Banks
BAX,Baxter International Inc. Common Stock,$85.55,0.23,0.27%,42834323878.00,United States,,2033694,Health Care,Medical/Dental Instruments
BB,BlackBerry Limited Common Stock,$9.48,0.07,0.744%,5375261190.00,Canada,,9869941,,
BBD,Banco Bradesco Sa American Depositary Shares,$3.38,0.04,1.198%,32750626853.00,Brazil,,28233039,Finance,Commercial Banks
BBDO,Banco Bradesco Sa American Depositary Shares (each representing one Common Share),$2.87,0.02,0.702%,27808964222.00,Brazil,,13747,Finance,Commercial Banks
BBL,BHP Group PlcSponsored ADR,$59.27,0.72,1.23%,149891553736.00,Australia,,1361355,Energy,Coal Mining
BBLN,Babylon Holdings Limited Class A Ordinary Shares,$6.42,0.02,0.313%,2631524359.00,United States,,418084,,
BBU,Brookfield Business Partners L.P. Limited Partnership Units ,$45.66,0.095,0.208%,3554405668.00,,2016,8553,Capital Goods,Building Products
BBVA,Banco Bilbao Vizcaya Argentaria S.A. Common Stock,$5.82,0.09,1.571%,38262447394.00,Spain,,1786187,Finance,Commercial Banks
BBWI,Bath & Body Works Inc.,$69.50,0.92,1.341%,17911743635.00,United States,,2888576,Miscellaneous,Diversified Commercial Services
BBY,Best Buy Co. Inc. Common Stock,$98.08,0.71,0.729%,23594212876.00,United States,,2486565,Consumer Services,Consumer Electronics/Video Chains
BC,Brunswick Corporation Common Stock,$96.87,1.00,1.043%,7468224423.00,United States,,319501,Consumer Non-Durables,Recreational Products/Toys
BCAT,BlackRock Capital Allocation Trust Common Shares of Beneficial Interest,$18.81,0.30,1.621%,2111690712.00,United States,2020,949693,Finance,Finance/Investors Services
BCC,Boise Cascade L.L.C. Common Stock,$68.41,0.38,0.559%,2690620507.00,United States,2013,184308,,
BCE,BCE Inc. Common Stock,$51.30,0.02,0.039%,46621440000.00,Canada,,691788,,
BCH,Banco De Chile Banco De Chile ADS,$16.11,0.08,0.499%,8136925875.00,Chile,,206090,Finance,Commercial Banks
BCO,Brinks Company (The) Common Stock,$64.73,1.38,2.178%,3181735960.00,United States,,215620,Miscellaneous,Diversified Manufacture
BCS,Barclays PLC Common Stock,$10.24,0.11,1.086%,42881669980.00,United Kingdom,,4915047,Finance,Commercial Banks
BDC,Belden Inc Common Stock,$63.72,0.83,1.32%,2860930954.00,United States,,134976,Basic Industries,Telecommunications Equipment
BDN,Brandywine Realty Trust Common Stock,$13.52,0.06,0.446%,2313626995.00,United States,,578263,Consumer Services,Real Estate Investment Trusts
BDX,Becton Dickinson and Company Common Stock,$248.91,1.07,0.432%,70950145227.00,United States,,964887,Health Care,Medical/Dental Instruments
BE,Bloom Energy Corporation Class A Common Stock,$22.00,0.38,1.758%,3860237964.00,,2018,2326159,Consumer Durables,Electrical Products
BEKE,KE Holdings Inc American Depositary Shares (each representing three Class A Ordinary Shares),$19.00,-0.35,-1.809%,22627055255.00,China,2020,5543369,Finance,Real Estate
BEN,Franklin Resources Inc. Common Stock,$33.42,0.55,1.673%,16769992209.00,United States,,942802,Finance,Investment Managers
BEP,Brookfield Renewable Partners L.P. ,$35.50,0.23,0.652%,9762869378.00,,,531318,Public Utilities,Electric Utilities: Central
BEPC,Brookfield Renewable Corporation Class A Subordinate Voting Shares ,$36.65,0.62,1.721%,6311265312.00,,2020,877643,,
BERY,Berry Global Group Inc. Common Stock,$70.31,0.25,0.357%,9534036000.00,United States,2012,427797,Consumer Non-Durables,Plastic Products
BFAM,Bright Horizons Family Solutions Inc. Common Stock,$123.21,4.15,3.486%,7438084943.00,United States,2013,291716,Miscellaneous,Other Consumer Services
BG,Bunge Limited Bunge Limited,$90.16,1.16,1.303%,12669301142.00,United States,2001,481241,Basic Industries,Industrial Specialties
BGS,B&G Foods Inc. B&G Foods Inc. Common Stock,$31.23,0.45,1.462%,2026730468.00,United States,,383830,Consumer Non-Durables,Packaged Foods
BHC,Bausch Health Companies Inc. Common Stock,$27.99,0.39,1.413%,10057667888.00,Canada,,5398156,,
BHG,Bright Health Group Inc. Common Stock,$3.76,0.25,7.123%,2363390856.00,,2021,9736041,Health Care,Medical Specialities
BHP,BHP Group Limited American Depositary Shares (Each representing two Ordinary Shares),$59.92,0.67,1.131%,151666777880.00,Australia,,2306744,Basic Industries,Precious Metals
BHVN,Biohaven Pharmaceutical Holding Company Ltd. Common Shares,$135.99,0.93,0.689%,8907516483.00,United States,2017,566172,Health Care,Biotechnology: Pharmaceutical Preparations
BILL,Bill.com Holdings Inc. Common Stock,$253.38,-4.91,-1.901%,25985059800.00,,2019,748445,Technology,Computer Software: Prepackaged Software
BIO,Bio-Rad Laboratories Inc. Class A Common Stock,$746.26,2.43,0.327%,22326780559.00,United States,,79819,Capital Goods,Biotechnology: Laboratory Analytical Instruments
BIP,Brookfield Infrastructure Partners LP Limited Partnership Units,$58.75,0.30,0.513%,17930171823.00,Bermuda,,192833,Public Utilities,Power Generation
BIPC,Brookfield Infrastructure Partners LP Class A Subordinate Voting Shares ,$67.26,0.79,1.189%,4934280433.00,,2020,154446,,
BJ,BJ's Wholesale Club Holdings Inc. Common Stock,$64.26,0.13,0.203%,8737085710.00,United States,2018,557733,Consumer Services,Department/Specialty Retail Stores
BK,The Bank of New York Mellon Corporation Common Stock,$58.11,0.20,0.345%,47988461971.00,United States,,1841905,Finance,Investment Managers
BKE,Buckle Inc. (The) Common Stock,$40.87,-0.21,-0.511%,2034646781.00,United States,,447663,Consumer Services,Clothing/Shoe/Accessory Stores
BKH,Black Hills Corporation Common Stock,$68.69,-0.27,-0.392%,4383814415.00,United States,,158063,Public Utilities,Electric Utilities: Central
BKI,Black Knight Inc. Common Stock ,$81.68,-0.51,-0.621%,12685730193.00,,2017,604369,Technology,EDP Services
BKU,BankUnited Inc. Common Stock,$41.89,0.17,0.407%,3732006742.00,United States,2011,448435,Finance,Savings Institutions
BLD,TopBuild Corp. Common Stock,$275.74,9.87,3.712%,9078769280.00,United States,2015,145140,Capital Goods,Engineering & Construction
BLDR,Builders FirstSource Inc. Common Stock,$82.15,1.09,1.345%,15731814379.00,United States,2005,2384508,Consumer Services,RETAIL: Building Materials
BLK,BlackRock Inc. Common Stock,$913.92,2.38,0.261%,138840146404.00,United States,1999,416330,Finance,Investment Bankers/Brokers/Service
BLL,Ball Corporation Common Stock,$90.00,-0.03,-0.033%,29150476380.00,United States,,1533894,Consumer Durables,Containers/Packaging
BMI,Badger Meter Inc. Common Stock,$105.19,-0.36,-0.341%,3076791511.00,United States,,74814,Capital Goods,Industrial Machinery/Components
BMO,Bank Of Montreal Common Stock,$105.91,0.41,0.389%,68657152524.00,Canada,,565335,,
BMY,Bristol-Myers Squibb Company Common Stock,$62.05,-0.05,-0.081%,137728968217.00,United States,,8076934,Health Care,Biotechnology: Pharmaceutical Preparations
BNL,Broadstone Net Lease Inc. Common Stock,$24.50,0.01,0.041%,3951033219.00,United States,2020,361041,Consumer Services,Real Estate Investment Trusts
BNS,Bank Nova Scotia Halifax Pfd 3 Ordinary Shares,$69.79,0.69,0.999%,84844058789.00,Canada,,1365969,,
BOH,Bank of Hawaii Corporation Common Stock,$83.35,0.68,0.823%,3354430169.00,United States,,92913,Finance,Major Banks
BOOT,Boot Barn Holdings Inc. Common Stock,$116.83,1.20,1.038%,3459217484.00,United States,2014,242821,Consumer Services,Clothing/Shoe/Accessory Stores
BOX,Box Inc. Class A Common Stock,$26.78,0.58,2.214%,3971461065.00,United States,2015,1263610,Technology,Computer Software: Prepackaged Software
